{
  "components": [
    {
      "approval": {
        "catalog_sha256": "512611dac72450a9333517af5f1cada2032ec429606d3dd2accf36b57f8353f5",
        "kind": "github_release",
        "published_at": "2026-09-29T16:18:18Z",
        "release_commit": "05bdaec7d0bd82615b7c0247df0d0737c59df71e",
        "tag": "nli-approved-hhm-3.5"
      },
      "component": "hhm",
      "files": [
        {
          "sha256": "fb89d11916e95483dd0db18e6d69104e0b097ee59c3f2df16830c65e50986e7d",
          "source": "objects/05_31_Ivolga_13/HHM3_FSE/modules/HHM3Circuit.js",
          "target": "/etc/wb-rules-modules/HHM3Circuit.js"
        },
        {
          "sha256": "0ae548cef5985594898224625fe3596b553783205f6c87a86f726f9106b94377",
          "source": "objects/05_31_Ivolga_13/HHM3_FSE/modules/HHM3Config.js",
          "target": "/etc/wb-rules-modules/HHM3Config.js"
        },
        {
          "sha256": "d57b1d86e0621f7def1352c6fb16ab9d2887c5508d0ba05abe052bafbcbe3fcd",
          "source": "objects/05_31_Ivolga_13/HHM3_FSE/modules/HHM3Mixing.js",
          "target": "/etc/wb-rules-modules/HHM3Mixing.js"
        },
        {
          "sha256": "dffebac6b2d565ddd3ec8c004cf4f8db6ab9802f57beeb06af978fd1ee4c675e",
          "source": "objects/05_31_Ivolga_13/HHM3_FSE/modules/HHM3Outputs.js",
          "target": "/etc/wb-rules-modules/HHM3Outputs.js"
        },
        {
          "sha256": "1f3742aa8fc733c8e9a850c72e0b5700056cf29295731d62a8ff515aad4dce71",
          "source": "objects/05_31_Ivolga_13/HHM3_FSE/modules/HHM3Runtime.js",
          "target": "/etc/wb-rules-modules/HHM3Runtime.js"
        },
        {
          "sha256": "6691f89231eda26db1b18d46ca4111ce1eaf3a085145144f78be2da14e3f6172",
          "source": "objects/05_31_Ivolga_13/HHM3_FSE/modules/HHM3Wire.js",
          "target": "/etc/wb-rules-modules/HHM3Wire.js"
        },
        {
          "sha256": "b2f6450eae2c1edb7fc225b04a3693ea3283818be86423d8e06f89b791a38ffd",
          "source": "objects/05_31_Ivolga_13/HHM3_FSE/boiler/wb-rules/500_HHM3_FSE.js",
          "target": "/etc/wb-rules/500_HHM3_FSE.js"
        },
        {
          "sha256": "72f6c546e807d5bd46978dd7a5ae1e602bfe0c182279e92cbf766ebf1124a7db",
          "source": "objects/05_31_Ivolga_13/Wirenboard/wb-rules/600_Heat_diagnostics.js",
          "target": "/etc/wb-rules/600_Heat_diagnostics.js"
        },
        {
          "sha256": "1f1c4d1087c8687f9e493845ee2c9048b4b0d7c2ae2f8f031da290df20b04f5f",
          "source": "objects/05_31_Ivolga_13/HHM3_FSE/boiler/wb-rules/620_thermostats.js",
          "target": "/etc/wb-rules/620_thermostats.js"
        }
      ],
      "manifest": {
        "commit": "05bdaec7d0bd82615b7c0247df0d0737c59df71e",
        "path": "NLI/releases/hhm-boiler-3.5.json",
        "sha256": "12d7946643ca2307bf0cf92fd582d33de19e83fa60c9a3c0c6b79c1f7e1f4be9"
      },
      "minimum_nst": "1.0.0",
      "release": {
        "commit": "48408e6f1649ad17d0b3253f1b7cade258cd4fb3",
        "repository": "psv76/Neirolinks"
      },
      "services": {
        "start": [
          "wb-rules"
        ],
        "stop": [
          "wb-rules"
        ]
      },
      "track": "stable",
      "version": "3.5"
    }
  ],
  "controller_serial": "ABF62SL",
  "diagnostics_profile": {
    "path": "Systems/NST/diagnostics/ivolga-boiler-hhm-v1.json",
    "sha256": "c2d0a81c57242f5e24fb062ca73043a76d565bed0d82266e66da2fbc8950b8b6"
  },
  "minimum_nst": "1.0.0",
  "node": "boiler",
  "object": "05_31_Ivolga_13",
  "object_files": [
    {
      "sha256": "dad4c1d6949c515c1c73ed7ad45fda455fe6ba58ef03e351eb9436fff098b11b",
      "source": "Objects/05_31_Ivolga_13/Wirenboard/wb-rules-modules/system.js",
      "target": "/etc/wb-rules-modules/system.js"
    },
    {
      "sha256": "4d7f290fd00347c916751d2cd19a2fa932c95a74e34e3420e8375993395614c8",
      "source": "Objects/05_31_Ivolga_13/Wirenboard/wb-rules/090_notification_service.js",
      "target": "/etc/wb-rules/090_notification_service.js"
    },
    {
      "sha256": "8e8034e8543bf9af4b8e532379aad213eb036fc3c5ee3bf46d522ef5d4800c1e",
      "source": "Objects/05_31_Ivolga_13/Wirenboard/wb-rules/100_power_monitor.js",
      "target": "/etc/wb-rules/100_power_monitor.js"
    },
    {
      "sha256": "cc0e261a1fb1747c4e42c142ead8013015a38d7ddb055af0437303a6bfc496af",
      "source": "Objects/05_31_Ivolga_13/Wirenboard/wb-rules/610_Boiler_state.js",
      "target": "/etc/wb-rules/610_Boiler_state.js"
    }
  ],
  "profile": {
    "path": "Objects/05_31_Ivolga_13/controllers/ABF62SL.json",
    "sha256": "c2d6542b9c17677ba2fa43bcdbe4eb061434efb2375c06affc79228394f0af8b"
  },
  "role": "boiler",
  "schema": 1,
  "services": {
    "start": [
      "wb-rules"
    ],
    "stop": [
      "wb-rules"
    ]
  },
  "signatures": [],
  "source": {
    "commit": "c09ebcedd32e27ba23abefb7800de8cfa66b5083",
    "repository": "psv76/Neirolinks"
  },
  "state": "active"
}
